topic,strength,coherence,core_content,connections
Information Theory,9,0.6323818,Information bottlenecks and relations to statistical learning theory | Information theory and connections to stat mech | The Eigenlearning Framework A theory of generalization in Kernel Ridge Regression. | Measure Theory and applications to probability theory | Neural Tangent Kernels A rough derivation of the neural tangent kernel.,Richness in Training Regimes The richness scale (from NTK to μP).
Neural Network Architectures,7,0.5902864,Boltzmann machines | Hopfield Networks A quick implementation of a Hopfield network in Python. | A barebones guide to Quantum Mechanics (just enough so that chemistry makes sense) | Some older ML architectures not frequently studied | Information bottlenecks and relations to statistical learning theory,
Markov Processes,2,0.66244787,Everything is a Markov process if your state is large enough | Boltzmann machines,
Category Theory & Tensor Structures,1,1.0,Category Theory (and perhaps tensors as symmetric monoidal structs on Vect or connections to homological mirror symmetry),
Cookie Story,1,1.0,Cookie Magic How I got ~$500 worth of cookies for free.,
